section,interpretation
Overall public message,The public-facing results support a cautious socioecological reading of adolescent sexual and reproductive-health outcomes.
Theoretical interpretation,"The original thesis logic is preserved: adolescent behavior is interpreted through individual, family, peer, school and psychosocial levels."
Final statistical result,"The most defensible public models are conservative M0 models adjusted for age, sex and grade."
Socioecological caution,"The dominance of M0 does not mean that family, school and peers are irrelevant; it means that richer models were not sufficiently stable for headline public conclusions."
"Family, school and peer levels","Family, school, peer and psychosocial blocks are reported as exploratory evidence and hypothesis-generating domains."
Main implication,Public communication should emphasize stable adjusted associations while preserving the socioecological interpretation.
