section,interpretation
Purpose,Script 13c tests whether school connectedness and school adjustment problems are associated with selected adolescent sexual and reproductive outcomes.
Primary school connectedness index,"The primary school connectedness index uses H1ED19, H1ED20, H1ED23 and H1ED24. It is reverse-coded so that higher values indicate stronger school connectedness or climate."
Extended school connectedness index,The extended school connectedness index uses H1ED19-H1ED24 and is retained as a sensitivity measure because its internal consistency is weaker.
School adjustment problems,The school adjustment/problem index uses H1ED15-H1ED18 and is scored so that higher values indicate more school-related problems.
ISX-inspired protection index,The ISX-inspired index follows the user's thesis logic: higher score indicates stronger sexual protection and lower score indicates higher exposure or risk.
Risk burden index,The risk burden index is exploratory and should not replace individual outcome models.
Public reporting status,All results from Script 13c should be treated as exploratory and hypothesis-generating unless later promoted after review.
